{
  "app_title": "Draftsman",
  "left_rail": {
    "sections": [
      {
        "id": "projects",
        "title": "Projects",
        "enabled": true,
        "items": [
          { "id": "project_slot", "label": "Project slot", "enabled": true }
        ]
      },
      {
        "id": "workflow",
        "title": "Workflow",
        "enabled": true,
        "items": [
          { "id": "scratch", "label": "Scratch", "enabled": true },
          { "id": "final", "label": "Final", "enabled": true },
          { "id": "archive", "label": "Archive", "enabled": false }
        ]
      }
    ]
  },
  "tabs": [
    { "id": "overview", "label": "Overview", "enabled": true },
    { "id": "artifacts", "label": "Artifacts", "enabled": true },
    { "id": "research", "label": "Research", "enabled": true },
    { "id": "plans", "label": "Plans", "enabled": true },
    { "id": "reviews", "label": "Reviews", "enabled": true },
    { "id": "sessions", "label": "Sessions", "enabled": true },
    { "id": "sources", "label": "Sources", "enabled": true },
    { "id": "timeline", "label": "Timeline", "enabled": true }
  ],
  "panels": [
    { "id": "project_overview", "label": "Project Overview", "tab": "Overview", "lines": [], "min_height": 96, "subtle": true, "enabled": true },
    { "id": "pinned_artifacts", "label": "Pinned Artifacts", "tab": "Overview", "lines": [], "min_height": 132, "subtle": false, "enabled": true },
    { "id": "review_queue", "label": "Review Queue", "tab": "Overview", "lines": [], "min_height": 112, "subtle": true, "enabled": true },
    { "id": "session_notes", "label": "Session Notes", "tab": "Overview", "lines": [], "min_height": 112, "subtle": false, "enabled": true },
    { "id": "decisions", "label": "Decisions", "tab": "Overview", "lines": [], "min_height": 88, "subtle": true, "enabled": true }
  ],
  "inspector": {
    "panels": [
      { "id": "inspector", "label": "Inspector", "tab": "*", "lines": [], "min_height": 72, "subtle": true, "enabled": true },
      { "id": "selection", "label": "Selection", "tab": "*", "lines": [], "min_height": 72, "subtle": true, "enabled": true },
      { "id": "properties", "label": "Properties", "tab": "*", "lines": [], "min_height": 86, "subtle": true, "enabled": true },
      { "id": "actions", "label": "Actions", "tab": "*", "lines": [], "min_height": 64, "subtle": true, "enabled": true }
    ]
  }
}
